{
  "server_1": {
    "type": "server",
    "events": [
      {
        "event_id": 4987616,
        "timestamp_start_event": "2026-01-07T16:02:08.815888",
        "timestamp_end_event": "2026-01-07T16:02:08.815888",
        "duration_event": "21654654",
        "event_type": "cpu_overflow"
      }
    ],
    "failure_prediction": "**Event Analysis and Failure Risk Prediction**\n\n**Event Details**\n\n* Event ID: 4987616\n* Resource: server_1 (server)\n* Event Type: cpu_overflow\n* Timestamp Start: 2026-01-07T16:02:08.815888\n* Timestamp End: 2026-01-07T16:02:08.815888 (immediate event)\n* Duration: 21654654 ( approx. 21.65 seconds)\n\n**Analysis**\n\nThe event log indicates a CPU overflow event on server_1, which suggests that the server's CPU was fully utilized, potentially causing performance degradation or even crashes. This type of event can be a precursor to more severe issues, such as system crashes or data corruption.\n\n**Predicted Failure Risk**\n\nBased on this single event, I would predict a moderate to high risk of future failures on server_1. The CPU overflow event may indicate:\n\n1. Insufficient resources: The server's CPU might be underpowered or overloaded, leading to frequent overflows.\n2. Resource-intensive workloads: The server may be running resource-intensive applications or processes, which can cause recurring CPU overflows.\n3. Configuration issues: Misconfigured system settings or inadequate resource allocation might contribute to CPU overflows.\n\n**Probability of Future Failures**\n\nGiven the severity of the event and the potential underlying causes, I estimate the probability of future failures on server_1 as follows:\n\n* Short-term (next 24 hours): 30% - 40% (moderate risk)\n* Medium-term (next 7 days): 50% - 60% (high risk)\n* Long-term (next 30 days): 70% - 80% (very high risk)\n\n**Recommendations**\n\nTo mitigate the risk of future failures, I suggest:\n\n1. Monitoring server_1's CPU usage and adjusting resource allocation or upgrading the server's hardware if necessary.\n2. Analyzing system logs to identify resource-intensive workloads or applications and optimizing their configuration.\n3. Implementing additional monitoring tools to detect potential issues before they become critical.\n\nBy taking proactive measures, the risk of future failures on server_1 can be reduced, ensuring optimal system performance and minimizing downtime."
  },
  "workstation_2": {
    "type": "workstation",
    "events": [
      {
        "event_id": 4987617,
        "timestamp_start_event": "2026-01-07T09:00:00.000000",
        "timestamp_end_event": "2026-01-07T11:00:00.000000",
        "duration_event": "7200",
        "event_type": "software_update"
      }
    ],
    "failure_prediction": "**Analysis of Events for Resource 'workstation_2'**\n\nAfter reviewing the provided event, I can conclude that:\n\n### Event Details\n\n- Event ID: 4987617\n- Timestamp (Start): 2026-01-07T09:00:00.000000\n- Timestamp (End): 2026-01-07T11:00:00.000000\n- Duration: 7200 seconds (2 hours)\n- Event Type: software_update\n\n### Prediction of Future Failures\n\nBased on the provided event, there are no obvious error patterns or anomalies that would indicate a high risk of future failures for the 'workstation_2' resource. The event indicates a planned software update, which is a routine maintenance task that should enhance system reliability.\n\nHowever, the success of the software update is crucial. Assuming the update was successful, and there were no errors reported, the risk of future failures should remain relatively low.\n\n**Predicted Probability of Future Failures:** Low\n\n**Risk Assessment:** The resource 'workstation_2' is likely in a stable state, considering the recent software update.\n\n**Recommendations:**\n\n1. Monitor system logs for any suspicious activity or error patterns.\n2. Perform regular software updates and system checks to maintain system reliability.\n3. Run system performance checks to ensure smooth operation of all components.\n\n**Confidence Level in Prediction:** 80%\n\nPlease note that this analysis is limited to the information provided and might not be comprehensive. Further data collection would be necessary for more accurate predictions.\n\n**Possible Steps to Improve Prediction Accuracy:**\n\n1. Ingest more system logs data to build a larger picture of system performance.\n2. Analyze similar events from other workstations for patterns and correlations.\n3. Consider incorporating performance metrics (e.g., system uptime, memory usage) into the analysis.\n\nPlease provide more data if you'd like to refine the prediction or re-run the analysis."
  },
  "automate_1": {
    "type": "automate",
    "events": [
      {
        "event_id": 4987618,
        "timestamp_start_event": "2026-01-07T14:30:00.000000",
        "timestamp_end_event": "2026-01-07T15:00:00.000000",
        "duration_event": "1800",
        "event_type": "fan_failure"
      }
    ],
    "failure_prediction": "**Analysis of Log Events for Resource 'automate_1' (automate)**\n\nBased on the provided log event, I will analyze the data to predict the probability of future failures for resource 'automate_1' (automate).\n\n**Event Details:**\n\n* Event ID: 4987618\n* Timestamp Start Event: 2026-01-07T14:30:00.000000\n* Timestamp End Event: 2026-01-07T15:00:00.000000\n* Duration Event: 1800 seconds (30 minutes)\n* Event Type: fan_failure\n\n**Observations:**\n\n1. **Single Event**: Only one event is provided, which makes it challenging to identify patterns or trends. However, I will make an educated analysis based on this single event.\n2. **Fan Failure**: The event type indicates a fan failure, which can be a critical component failure, potentially leading to overheating, reduced performance, or even complete system failure.\n3. **Duration**: The event lasted for 30 minutes, which is a relatively short duration. This might indicate a temporary issue or a successful automatic recovery mechanism.\n\n**Predictive Analysis:**\n\nGiven the limited data, I will consider the following factors to predict the probability of future failures:\n\n1. **Component Failure**: A fan failure is a relatively rare event, but it can be indicative of a larger issue, such as poor maintenance, high environmental temperatures, or component wear.\n2. **System Resilience**: The fact that the event lasted only 30 minutes suggests that the system might have automatic recovery mechanisms in place, which reduces the likelihood of subsequent failures.\n3. **Lack of Pattern**: With only one event, it's difficult to identify patterns or trends that could indicate a higher likelihood of future failures.\n\n**Probability of Future Failures:**\n\nBased on the analysis, I would estimate the probability of future failures for resource 'automate_1' (automate) as follows:\n\n* **Short-term (next 24 hours)**: 5% - The system has already experienced a fan failure and has recovered, which suggests a relatively low likelihood of an immediate subsequent failure.\n* **Medium-term (next 7 days)**: 10% - Without additional data, it's challenging to predict the likelihood of future failures. However, the system's ability to recover from the fan failure suggests a moderate level of resilience.\n* **Long-term (next 30 days)**: 20% - As more time passes, the likelihood of future failures may increase due to potential underlying issues or component wear.\n\n**Recommendations:**\n\n1. **Regular Maintenance**: Schedule regular maintenance checks to ensure the system's fans and other components are functioning correctly.\n2. **Environmental Monitoring**: Monitor the environmental conditions (temperature, humidity, etc.) to identify potential contributing factors to the fan failure.\n3. **System Monitoring**: Continuously monitor the system's logs and performance metrics to quickly identify and respond to potential issues.\n\nBy following these recommendations, you can reduce the likelihood of future failures and ensure the continued operation of resource 'automate_1' (automate)."
  },
  "internet_gateway_1": {
    "type": "internet_gateway",
    "events": [],
    "failure_prediction": "Low risk (No recent events)"
  }
}